<?xml version="1.0" encoding="UTF-8"?>
<partner xmlns="https://christian-seiler.github.io/ws3C"
		 xmlns:xsi="http://www.w3.org/2001/XMLSchema-instance"
		 xsi:schemaLocation="https://christian-seiler.github.io/ws3C
        partner.xsd">

	<sponsor>
		<title>Raiffeisen</title>
		<image>raiffeisen.png</image>
		<url>www.raiffeisen.ch/wohlen</url>
	</sponsor>
	<sponsor>
		<title>A. Käppeli's Söhne AG</title>
		<image>kaeppeli.png</image>
	</sponsor>
	<sponsor>
		<title>Gemeinde Wohlen</title>
		<image>wohlen.png</image>
		<url>wohlen.ch</url>
	</sponsor>
	<sponsor>
		<title>Wohler Anzeiger</title>
		<image>wohleranzeiger.png</image>
		<url>wohleranzeiger.ch</url>
	</sponsor>
	<friend>
		<title>Brugger Modelleisenbahn-Club</title>
		<image>bmc.png</image>
		<url>bmc-brugg.ch</url>
	</friend>
	<friend>
		<title>Eisenbahn-Modellbau-Club Aarau</title>
		<image>emca.png</image>
		<url>emcaarau.ch</url>
	</friend>
	<friend>
		<title>Schweizerischen Verband Eisenbahn-Amateur SVEA</title>
		<image>svea.png</image>
		<url>svea-asea.ch</url>
	</friend>
</partner>
